,Review_text,Sentiment_NLTK_numeric
6238,good product Mavis 350 ossm yonex MavisREAD MORE,1
6240,super qualityREAD MORE,1
6241,the shuttle we're original but they were very old and break very easilyREAD MORE,1
6243,nice productREAD MORE,1
6245,good productREAD MORE,1
6246,GoodLong lastingJust love it 👌READ MORE,1
6247,Best ever.READ MORE,1
6248,"Delivery in time , Good quality shuttle..READ MORE",1
6250,worth to buyREAD MORE,1
6251,quality is bad. Got damaged after playing 2-3 matchesREAD MORE,0
6252,good itemREAD MORE,1
6256,good productREAD MORE,1
6257,original and best ..READ MORE,1
6258,Yes it's good shuttle at such a lowest priceREAD MORE,1
6259,Reasonable price and best performance. Please reduce the price if possible.READ MORE,1
6261,the parcel was good then before and it was quick as the time givenREAD MORE,1
6263,good n genuine productREAD MORE,1
6265,nice product...... Thankyou.READ MORE,1
6268,really good product....READ MORE,1
6271,"good quality..... but green one is the slow one (singles), if u wanted a medium fast shuttle go for blue tappedREAD MORE",1
6273,it is nice so muchREAD MORE,1
6274,Worst product. The shuttle doesnt work even for 10matchesREAD MORE,0
6275,Poor qualityREAD MORE,0
6276,awesome productREAD MORE,1
6279,Very bad corckREAD MORE,0
6282,"Good, expecting at low price.READ MORE",1
6287,good qualityREAD MORE,1
6288,Excellent serviceREAD MORE,1
6289,nice. shuttleREAD MORE,1
6290,Great product. Love itREAD MORE,1
6294,Good productREAD MORE,1
6295,best shuttle for all beginer as well as for expertREAD MORE,1
6297,superb qualityREAD MORE,1
6298,nice product.. i brought for ₹709 good one for this prizeREAD MORE,1
6299,stop scrolling. Buy the product. quality is good. Remember we are not international players to look 💯 results.READ MORE,1
6300,nice brandREAD MORE,1
6301,Nice ProductREAD MORE,1
6302,bad productREAD MORE,0
6303,Worst item doublecat send me pls avoid thisREAD MORE,0
6304,Best as alwaysREAD MORE,1
6307,I paid full so deserve to get in time and sound conditions.. nothing to appreciate about it.. however Thanks.READ MORE,0
6308,Nice productREAD MORE,1
6313,Waste do not buyREAD MORE,0
6314,original and genuine product. thanks flipkartREAD MORE,1
6319,"good price,READ MORE",1
6320,Worst shuttle 200i z better dn diz 350iREAD MORE,0
6321,not played yet but seems goodREAD MORE,0
6322,good one.READ MORE,1
6326,good oneREAD MORE,1
6327,this is not yonex original product.... compare with original one the weight is little bit high....READ MORE,0
6328,Value for money. Nice product.READ MORE,1
6331,good shuttlesREAD MORE,1
6333,very good productREAD MORE,1
6334,Not very good as I acceptedREAD MORE,0
6336,Poor QualityREAD MORE,0
6338,awesome thanks for the quick deliveryREAD MORE,1
6339,very good qualityREAD MORE,1
6341,good and original product.READ MORE,1
6343,genuine  product and nice quality. good for the intermediatesREAD MORE,1
6344,"it seemed it was old stock. shuttle wooden base was damaged (presence of piercing many holes on shuttle base). it is advised to check shuttles physically on nearest shop & then purchase, although it may cost few bucks more but u will b satiesfied 4 a gud purchase.READ MORE",0
6346,very good packaging and super fast delivery. thanksREAD MORE,1
6347,perfect oneREAD MORE,1
6348,nice oneREAD MORE,1
6349,nice corkREAD MORE,1
6350,good niceREAD MORE,1
6357,nice productREAD MORE,1
6358,awesome & delivered early too thanks for that... and ya the same product we bought from market is 170 per shuttle.... which is too high for the same product... I must say go for itREAD MORE,1
6359,good qualityREAD MORE,1
6361,Very Good Shuttle.READ MORE,1
6362,one one  shuttle is ok. and others are new but not playable because of viberent in air.READ MORE,1
6365,Very bad product it is too light weight to play i think its not the actual yonex 350READ MORE,0
6366,Good OneREAD MORE,1
6367,good quality product.READ MORE,1
6369,Sorry for negetv revw... this is a genuine oneREAD MORE,0
6370,Nice oneREAD MORE,1
6371,This shuttle is not good for professional or intermediate player'sREAD MORE,0
6372,saved minimum 150 rupees compared to least available price and product is original thank you FlipkartREAD MORE,1
6374,super good gualityREAD MORE,1
6375,nice shuttle.... long lastREAD MORE,1
6377,These are very bad shuttles. I think they have given local product do not buy this product from flipkart I am not happyREAD MORE,0
6378,this time is better but the last time was not satisfied.READ MORE,1
6380,it is very nice product❤❤❤READ MORE,1
6381,"Nice products, beautiful...READ MORE",1
6382,The box almost lost its shape when it got delivered to me.READ MORE,0
6384,On each barrel one of the shuttle is defect one.READ MORE,0
6389,Original products. Quality exalentREAD MORE,1
6390,good for good priceREAD MORE,1
6392,Nice productREAD MORE,1
6394,it's orignal and very good qualityREAD MORE,1
6395,corks container not in s good shapeREAD MORE,0
6397,nice productREAD MORE,1
6398,"good product..... Box quality not good, And packing quality must need improvedREAD MORE",1
6399,good original product but it's price doesn't dip even on salesREAD MORE,1
6405,"a super fast delivery,,, of course a good packingREAD MORE",1
6406,Very good product.. Thanks flipkart..READ MORE,1
6409,Shuttle box came in perfect condition and shuttles are good and wellREAD MORE,1
6411,super goodREAD MORE,1
6414,Worth for your moneyREAD MORE,1
6416,Very good productREAD MORE,1
6417,"packaging is poor, box one side has been crushed. shuttles are in good shape and qualityREAD MORE",0
6418,"Nice product, and timely delivery. Good job.READ MORE",1
6419,poor quality deliveresREAD MORE,0
6420,worst shuttle ever receivedREAD MORE,0
6421,Good prodectREAD MORE,1
6423,good productREAD MORE,1
6424,Very good productREAD MORE,1
6426,Original product..READ MORE,1
6427,Good qualityREAD MORE,1
6428,shuttle has a very good balance but very costlyREAD MORE,1
6429,nice!  no damaged shuttle. very happy.READ MORE,0
6430,every time packing is very good but this time it's very poor.except that everything is fine.READ MORE,1
6431,"Perfect shuttle, having great flightREAD MORE",1
6432,it's good but costlyREAD MORE,1
6434,not value for moneyREAD MORE,0
6437,Good Responce & fast DeliveryREAD MORE,1
6440,good productREAD MORE,1
6443,This is worst product.Dont waste our moneyREAD MORE,0
6446,best in class for indoor this is bestREAD MORE,1
6447,value for money...READ MORE,1
6448,It's as good as expected.READ MORE,1
6449,Nice productREAD MORE,1
6450,Good oneREAD MORE,1
6451,it is not good as previous 1 damaged I gotREAD MORE,0
6455,"writing this review after using a couple of shuttle's.these are not original. yes I repeat they are not original. starting from the box, it's cheap replica, you can tell that by looking at the plastic lid. Shuttle won't last for more than 2 games. Flipkart/Vendor is cheating customers.READ MORE",0
6456,"Im not at all satisfied with these product this is second quality product, slowly flipkart is lossing the assuranceREAD MORE",0
6457,it's a very nice product..READ MORE,1
6459,Perfect. Just go for it. Got in time. Thanks Flipkart.READ MORE,1
6460,Good productREAD MORE,1
6461,very poor qualityREAD MORE,0
6463,Best :)READ MORE,1
6465,A pack of 6 quality well maintained shuttlesREAD MORE,1
6466,It is a very well product......no doubt...READ MORE,1
6469,Good product at a great price .. purchased for 1215 r.s of two boxREAD MORE,1
6471,"Product genuine, good. Packaging inadequate. Shuttles bent due to no outer protection, soft cardboard box.READ MORE",0
6472,poor qualityREAD MORE,0
6479,there is duplicate in some of Flipkart products which I have heard couple of days back but now am facing the issue .. I have used this shuttle very first time from Flipkart and it actually tear off within 20-30 shots I have used 3 shuttles with a span of 40 min. game.  I suggest you kindly purchase from somewhere elseREAD MORE,1
6480,Low prices and very good articleREAD MORE,1
6481,very bad shuttle because hiii dammage with in a one gameREAD MORE,0
6483,Worth of money product only for rs 675 on sale really I loved this awesomeREAD MORE,1
6484,wonderful productREAD MORE,1
6485,excellent productREAD MORE,1
6487,good one for indore gamesREAD MORE,1
6488,good qualityREAD MORE,1
6489,Good Packaging and good productREAD MORE,1
6490,waste prouctREAD MORE,0
6491,good shuttlesREAD MORE,1
6492,Good shuttle for outdoor advance player..After 2 days it slightly heavierREAD MORE,1
6493,Good service thankREAD MORE,1
6494,Super I'm very HappyREAD MORE,1
6495,nice good quality product.READ MORE,1
6496,quality is low but okeyREAD MORE,0
6498,product is very good but worst packing by flipkart product got damage because of packing .READ MORE,0
6499,Great shuttle but wised if it’s more durableREAD MORE,1
6500,quality not good as expectedREAD MORE,0
6503,delivery on tym.... satisfy with productsREAD MORE,1
6506,awesome as usualREAD MORE,1
6507,original shuttle carkREAD MORE,1
6510,Received packed was crushed at flat cap  due to which one shuttle was pressed & uselessREAD MORE,0
6512,good product but lost 2 shuttles in 5 days not for professionalsREAD MORE,0
6513,"Best suitable for indoor practice , durable and value for money.READ MORE",1
6515,"delivered on time and good product, giving review after completely usedREAD MORE",1
6516,this is a bad productREAD MORE,0
6517,good oneREAD MORE,1
6518,Nice product tiemly provided....READ MORE,1
6520,good product valuableREAD MORE,1
6522,good one and with cheaper pricrREAD MORE,1
6523,defective productREAD MORE,0
6524,Good quality shuttle...bad packing while delivery..tin was twisted due to the tight packing...hope better delivery next timeREAD MORE,1
6525,super productREAD MORE,1
6526,Good quality I suggest you.....READ MORE,1
6528,flipkart assured always the best😁READ MORE,1
6529,There is no dpubt that mavis 350 is one of the best shuttlecocks in this price range... I always purchase this for playing match with friends...i am happy with flipkartREAD MORE,1
6530,it is better than previous ones. I have purchased it before also via flipkart but that was worst. but I like it. go for it ..READ MORE,0
6532,felt it's pretty slowREAD MORE,1
6533,Product is good but delaye deliveredREAD MORE,1
6534,"Not Good Quality of product, not as per Yonex stander.after few games only, product gets damaged.READ MORE",0
6535,best of bestREAD MORE,1
6537,nice product must buyREAD MORE,1
6541,Product is good.. but the packaging wasn't being taken care off properly. The box which I received was a bit squeezed from two sides damaging one shuttle inside the box.READ MORE,0
6545,These days Mavis 350 shuttlebox containing duplicate shuttles. Got 3 shuttles as lite weight which are not suitable to play. Other 3 shuttles are good. Purchased 2 shuttleboxes and both are same. Not sure if it is the problem with Flipkart seller or manufacturing problemREAD MORE,0
6549,the shuttle  damaging after few gamesREAD MORE,0
6555,go for.it original product 😍READ MORE,1
6557,Quality of the shuttle is not at all good after playing for 15-20 min got breakage in the middle of the shuttle and breakage in the cork made us dissatisfied with the product....READ MORE,0
6558,Good one. Received original product.  Thanks to FlipkartREAD MORE,1
6559,Good qualityREAD MORE,1
6566,good as alwayREAD MORE,1
6568,"awesome, original & fresh productREAD MORE",1
6570,very nice thnks for flipkartREAD MORE,1
6572,Best value for price...... Better than any shutttleREAD MORE,1
6577,nice shuttleREAD MORE,1
6579,Good product....READ MORE,1
6581,Satisfied with the productREAD MORE,1
6582,this is good shuttle but i found mavis 2000 more durable...READ MORE,1
6583,The box of shuttle was dented. seems like the delivery boy has kept lots of items on it and the box shape was distorted. shuttles are fine.READ MORE,0
6584,best qualityREAD MORE,1
6588,Nceee one and useful for Intermediate ppl'sREAD MORE,1
6589,"competitive price, fast deliveryREAD MORE",1
6590,good shuttleREAD MORE,1
6592,Best Shuttle Ever For Basminton...READ MORE,1
6595,superb quality ....i satisfied thanks to flip kart..READ MORE,1
6596,Wonderful shuttlesREAD MORE,1
6597,tnx to teamREAD MORE,1
6599,Good quality...New stockREAD MORE,1
6600,online purchased yonex Mavis 350 is not Good quality.... don't purchase ...READ MORE,0
6601,nice qualotyREAD MORE,1
6602,Authentic product... new stock... great price ... bought at 610 ...READ MORE,1
6605,Poor quality materialREAD MORE,0
6607,Packing was pathetic. Completely damaged..box was broken... Slightly damaged cork.. Never expected this from flipkartREAD MORE,0
6609,Good productREAD MORE,1
6610,"replacement came bit late, perfect shuttle with perfect priceREAD MORE",1
6612,Excellent for Badminton court.. And especially  beginnersREAD MORE,1
6613,good productREAD MORE,1
6615,superb niceREAD MORE,1
6617,"delivery is too bad .,,...but product is goodREAD MORE",0
6621,low qualityREAD MORE,0
6623,The shuttles look genuine but are suuuperrrrr slow. Can't play with them. Really disappointed.READ MORE,0
6624,Very bad quality shuttle.....and very very pathetic packing....READ MORE,0
6629,Best buy. Good quality Shuttle. No cons.READ MORE,1
6630,very bad qualityREAD MORE,0
6631,Good quality..READ MORE,1
6632,very much delayed delivery. product is genuine.READ MORE,0
6633,nice shuttleREAD MORE,1
6635,All shuttles were in good condition.READ MORE,1
6637,nice product and speedy deliveryREAD MORE,1
6639,The box had got crushed in the cardboard box. Please don't pack in thin cardboard boxes. Instead pack it in plastic covers along with the bubble sheet wrapped around the box. This way the shuttles won't get damaged. Slightly out of shape......the shuttlles will not perform at all... So next time I order shuttles I expect a proper delivery without damage or else I will return.READ MORE,1
6640,"Out of 6 shuttle , 4 of them were good,  2 of them were bad.READ MORE",1
6641,Nice productsREAD MORE,1
6642,good qualityREAD MORE,1
6643,Nice product by FlipkartREAD MORE,1
6645,it's original. You can check it on Yonex website. and it is definitely at lower price than nearby shopsREAD MORE,1
6646,superb product and delivered before expected dateREAD MORE,1
6647,I am a regular user of this product. I am happy that i bought it on deal.READ MORE,1
6648,"Very good, slow shuttle speed like pro shuttles. Balanced , durable.Go for it.READ MORE",1
6651,bad qualityREAD MORE,0
6653,nice shuttleREAD MORE,1
6654,awesome productREAD MORE,1
6655,Good productREAD MORE,1
6657,Quality is not good enoughREAD MORE,0
6658,Best shuttle out there for every talent group.READ MORE,1
6659,I always preffered Mavis 350 Slow for My indoor Court. Best one 👌👌READ MORE,1
6661,As expected nice quality and quantity.READ MORE,1
6663,Product is in good condition and received on timely also the behaviour of the sales is very politeREAD MORE,1
6664,Good and fast shuttle..lasts longREAD MORE,1
6666,nice shuttles.... although it gets bit fast after few shotsREAD MORE,1
6669,For daily practice the best shuttle you can have. Very SatisfiedREAD MORE,1
6670,Very nice shuttles compared to other shuttles it's very goodREAD MORE,1
6671,great price 609 and good qualityREAD MORE,1
6672,good ... just used one but it lasted long... as little experienced find the slowing down of cork little awkwardREAD MORE,1
6673,flirty quality corckREAD MORE,1
6674,very worst quality after playing 2 to 3 games cork HOVERINGREAD MORE,0
6675,"product is good, but worst customer service took them 2 weeks to deliver itREAD MORE",0
6677,poor qualityREAD MORE,0
6679,Long durable  superb ShuttleREAD MORE,1
6686,"Worth to buy, lasting for two days for two hours of play.READ MORE",1
6687,good value for moneyREAD MORE,1
6688,Good product... long lastingREAD MORE,1
6689,Good.. Nice quality and useful priceREAD MORE,1
6690,Super Excellent product at best price.... It also original verified....READ MORE,1
6694,nice productREAD MORE,1
6695,it's worth of moneyREAD MORE,1
6698,"The product is awesome, got the delivery in 2 days.READ MORE",1
6699,good cualityREAD MORE,1
6702,The best shuttleREAD MORE,1
6703,Excellent productREAD MORE,1
6706,Good proddectREAD MORE,1
6707,really nice.....very durable and nice quality al well... perfect for practicing professional and for regular use tooREAD MORE,1
6712,Quality of product is very poor. Green cap is recommended for slow. But It was fast while playingREAD MORE,0
6714,nice oneREAD MORE,1
6715,slow shuttle with good flight and superb accuracy.READ MORE,1
6719,Many a time when I buy shuttlecocks from elsewhere it starts wobbling after a match or so. But these shuttles were great. A single shuttle  easily last around 10 matches. Reliable I would say! And on time delivery by Flipkart.READ MORE,1
6720,Very nice quality and especially for indoor this colored ones helps for better Visibility.READ MORE,1
6721,nice productREAD MORE,1
6722,A couple of shuttles had more speed than expected. Overall good product.READ MORE,1
6725,its a very good productREAD MORE,1
6726,always preferred choice this one...I like itREAD MORE,1
6727,good quality but on the slower side even for outdoor.READ MORE,1
6728,excellent product thanksREAD MORE,1
6730,product is as expected. but the one that I am very satisfied is with the delivery. ordered the night before and received the product in hand by 8AM next day. 5/5 to the seller for quick deliveryREAD MORE,1
6733,Excellent product with very fast delivery ...wonderful service Flip KartREAD MORE,1
6739,better 👍READ MORE,1
6740,PRODUCT IS OF VERY GOOD QUALITY BUT PROPER ATTENTION SHOULD BE GIVEN TO DELICATE ITEMS DURING TRANSPORTATION.READ MORE,1
6741,good qualityREAD MORE,1
6742,Good product.Worth for priceREAD MORE,1
6745,Very good product..READ MORE,1
6747,this is original yonex good shuttle lasts long and flight path is excellent for outdoorsREAD MORE,1
6748,Nice productREAD MORE,1
6749,fast delivery ....thanks fksuper original productsREAD MORE,1
6750,nice productREAD MORE,1
6752,packing of the box is not good one of the shuttle got tear due to worst packingREAD MORE,0
6753,nice productREAD MORE,1
6754,Good productREAD MORE,1
6755,no words... simply superbREAD MORE,0
6759,best shuttle thanku flippant ☺😊😇😇READ MORE,1
6761,"I honestly had a bad experience with it. The shuttles looked fine but after 3-4 games, I would say intermediate level, it started tearing off.READ MORE",1
6762,Happy with this productREAD MORE,1
6767,It is best product. I am using it from one month it is still goodREAD MORE,1
6769,I am playing from 3 yrs and I got this the best shuttleREAD MORE,1
6770,It's very fast shuttle But after playing 1 day its okREAD MORE,1
6771,overall good but some times shuttles are way fast to play i.e I used to order 4 pack a month and every 1 or 2 month 1 of the pack all the shuttles are having this issue may be duplicate..READ MORE,1
6772,nice corkREAD MORE,1
6773,good oneREAD MORE,1
6775,Good shuttle for indoor use. We are a bunch of intermediate to advances shuttlers and the flight of these greencap shuttles is good. There can be some variation though from one box to another in the speed.The shuttle lasts a long time and that can be a problem because the flight pattern changes after say 12-15 games. So you may want to toss the shuttle once it reaches that stage.Overall a very good value for money plastic shuttle that plays somewhat similar to feather but lasts a lot lon...READ MORE,1
6777,found genuine and delivered well on time.READ MORE,1
6780,the shuttle was not good very slow and it broke in 1 day one shuttle . where was I purchased offline it was going for 3 daysREAD MORE,0
6782,original one good qualityREAD MORE,1
6783,Long lasting. Good Quality. This shuttle is good for begineers.READ MORE,1
6784,Good productREAD MORE,1
6786,the shuttlecock speed is fast compared to what my friend's bought. I doubt the quality of the packREAD MORE,0
6787,Product Good... But delivery delay in Bangalore city inside itself...HmmREAD MORE,0
6789,product is too much good but packaging are not good. please improve your packaging sir/mam.....ThankuREAD MORE,1
6790,"very bad, cheap quality, high cost, watage of money.READ MORE",0
6791,"good ,it's originalREAD MORE",1
6792,Durability of MAVIS 350 SHUTTLE CORKS is not to the expected level now the quality has decreased please check and revert backREAD MORE,1
6793,Buying yonex online will always benefit you cost wise. My only complaint is that the box was a bit squashed due to transportation.READ MORE,1
6794,very much durable for Rs.701  its awesome ...very durable ..READ MORE,1
6795,love itREAD MORE,1
6796,best shuttle in this price range .but this one was very bad whole box lasted only for 18 days .as I am regular buyer this box lasts for minimum of 40 days.but maybe the old stock was given this time . although the best product in this price tangeREAD MORE,1
6797,Good stuff.READ MORE,1
6800,Good product...READ MORE,1
6801,"packing not Well, your packing not protect to productREAD MORE",0
6802,good oneREAD MORE,1
6803,shipping was not handled well and shuttles overturned by thatREAD MORE,0
6804,"plastic cover was torn slightly, product goodREAD MORE",0
6805,good productREAD MORE,1
6807,Nice Shuttles.READ MORE,1
6809,product is good but service is worstREAD MORE,1
6810,good shuttle close to feather speedREAD MORE,1
6811,Genuine product. Great delivery time. Totally Satisfied.READ MORE,1
6812,super qualityREAD MORE,1
6813,Recive original product thanksREAD MORE,1
6814,packing and parsal both are good qualityREAD MORE,1
6816,good qualityREAD MORE,1
6820,Good productREAD MORE,1
6821,"Good, but looks like old stockREAD MORE",1
6823,good oneREAD MORE,1
6825,"some of bird heads are stained with little mud. I was worried whether these are used ones, but those are good in flight and quality.READ MORE",1
6826,Its original. Verified by its scratch code.READ MORE,1
6827,same good qualityREAD MORE,1
6828,nice app reliable and genuine products are delivered  thanksREAD MORE,1
6829,Shuttle is too slow not as what we get from the offline marketREAD MORE,0
6831,Great product. But charges was high in online purchases near by sports shopREAD MORE,0
6834,good productREAD MORE,1
6835,good qualityREAD MORE,1
6836,it's good productREAD MORE,1
6837,Good and very fast deliveryREAD MORE,1
6838,good price 700/-READ MORE,1
6840,Fantastic Quality!READ MORE,1
6843,great and cheap as per marketREAD MORE,1
6844,As always a good PickREAD MORE,1
6845,nice product...u can go for itREAD MORE,1
6847,Good productREAD MORE,1
6848,this is the best ever i have recieved everREAD MORE,1
6849,Gud shuttle... Worth the penny...READ MORE,1
6850,good in lessREAD MORE,1
6852,"excellent quality, strong shuttle for practice, very much durableREAD MORE",1
6853,very worst shuttle comeREAD MORE,0
6854,Good product. Genuine. Delivery on time.READ MORE,1
6856,nice oneREAD MORE,1
6858,"worst standard of packing and product. box was already crushed from one side, no fillers to protect the box. shuttle container lid is so cheap and thin that it's almost see through type of lid. Flipkart and Yonex should check the authenticity of the product and sellerREAD MORE",0
6859,Good productREAD MORE,1
6860,Very poor quality shuttles. Not withstanding even one hour singles gameREAD MORE,0
6861,there are 2 damaged shuttles out of 6..not satisfiedREAD MORE,0
6864,Awesome productREAD MORE,1
6867,ok seems okREAD MORE,1
6869,good qualityREAD MORE,1
6870,These shuttles are different compared with what we buy from showroom.. Don't know the exact reason. These shuttles look like cheaper quality. That's why a three star...READ MORE,1
6871,good conditionREAD MORE,1
6877,thank youREAD MORE,1
6879,suttles are good but packing is very poorREAD MORE,1
6881,These are really nice shuttle under a good price range.READ MORE,1
6882,good qualityREAD MORE,1
6883,nice one...READ MORE,1
6884,good productREAD MORE,1
6885,nice and durable..slow speedREAD MORE,1
6886,Bad qualityREAD MORE,0
6887,I am playing badminton from last 6 month. Quality has been good so far but I believe they will make better Shuttle in coming soon.READ MORE,1
6889,good qualityREAD MORE,1
6890,it was good product niceREAD MORE,1
6891,good qualityREAD MORE,1
6892,nice product. Reached earlier than expectedREAD MORE,1
6893,good oneREAD MORE,1
6894,Good quality..READ MORE,1
6896,its a good productREAD MORE,1
6898,good product. Thanks for fast delivery.READ MORE,1
6903,Nice good priceREAD MORE,1
6905,Very competitive price. Fast delivery.READ MORE,1
6907,Nice productREAD MORE,1
6909,"good shuttle , thanks to Flipkart for a speedy delivery, product is authentic n original.READ MORE",1
6910,Hope the price remains same.Mavis 350 Oginal product. 👍READ MORE,1
6912,bad qualityREAD MORE,0
6913,OK niceREAD MORE,1
6915,great productREAD MORE,1
6917,recommended to friend ..genuine productREAD MORE,1
6918,best quality.READ MORE,1
6919,best for the intermediate playerREAD MORE,1
6920,good dealREAD MORE,1
6922,very good productREAD MORE,1
6923,it's a nice product by YonexREAD MORE,1
6924,nice products and thanks flipcart... for deliveryREAD MORE,1
6925,Prompt delivery and good packaging ...last time wrong and damaged shipment made ..but this time took corrective action..Thank you.READ MORE,0
6927,super shuttleREAD MORE,1
6928,Very happy with the product ☺️READ MORE,1
6930,awesome nice productREAD MORE,1
6933,very nice productREAD MORE,1
6934,nice oneREAD MORE,1
6936,Very good & nice productREAD MORE,1
6937,Good qualityREAD MORE,1
